Event_Title,Date,Time,Venue,Address,url,Latitude,Longitude,Category
Ingested + Algor Mortis + Gutless + Growth - Melbourne - Max Watts,2025-07-24,00:00,Max Watts,"125 Swanston St, Melbourne VIC 3000, Australia",https://www.facebook.com/events/705556305257698/,-37.8147557,144.9659879,Music
Linocut,2025-07-24,10:00,Australian Print Workshop,"210 Gertrude St Fitzroy, VIC 3065",https://www.eventbrite.com.au/e/linocut-tickets-1204362985109?aff=ebdssbdestsearch,-37.8064244,144.9815567,Art
Christmas in July Lunch at Overnewton Castle,2025-07-24,12:00,Overnewton Castle,"51 Overnewton Road Keilor, VIC 3036",https://www.eventbrite.com.au/e/christmas-in-july-lunch-at-overnewton-castle-tickets-1204363737359?aff=ebdssbdestsearch,-37.7048096,144.8209018,Social/Dating
Christmas in July Dinner at Overnewton Castle,2025-07-25,19:00,Overnewton Castle,"51 Overnewton Road Keilor, VIC 3036",https://www.eventbrite.com.au/e/christmas-in-july-dinner-at-overnewton-castle-tickets-1204356064409?aff=ebdssbdestsearch,-37.7048096,144.8209018,Social/Dating
Presentations With A Difference,2025-07-25,09:00,Karstens Conference Centre,"Level 11, 123 Queen Street Melbourne, VIC 3000",https://www.eventbrite.com.au/e/presentations-with-a-difference-tickets-912987880327?aff=ebdssbdestsearch,-37.8157528,144.9607103,Talks/Workshops
Parts of Me: Understanding Schemas in Motherhood,2025-07-25,11:00,Brunswick,"Brunswick Brunswick, VIC 3056",https://www.eventbrite.com.au/e/parts-of-me-understanding-schemas-in-motherhood-registration-1330461037779?aff=ebdssbdestsearch,-37.7666099,144.9584302,Talks/Workshops
Supporting Learners with CVI and Complex Physical Disabilities,2025-07-25,09:00,Cerebral Palsy Education Centre,"Beacon Street Glen Waverley, VIC 3150",https://www.eventbrite.com.au/e/supporting-learners-with-cvi-and-complex-physical-disabilities-tickets-1311303968469?aff=ebdssbdestsearch,-37.8856164,145.1635261,Talks/Workshops
GT Festival Sandown - Shannons SpeedSeries,2025-07-25,09:00,Sandown International Motor Raceway,"591-659 Princes Hwy Springvale, VIC 3171",https://www.eventbrite.com.au/e/gt-festival-sandown-shannons-speedseries-tickets-1235961266419?aff=ebdssbdestsearch,-37.9441995,145.1683789,Sport
Groove Dimension-70s Funk-RNB & Disco-Soul,2025-07-25,20:30,Olympic Hotel,"31 Albert Street Preston, VIC 3072",https://www.eventbrite.com.au/e/groove-dimension-70s-funk-rnb-disco-soul-tickets-1336241888459?aff=ebdssbdestsearch,-37.7465792,145.021604,Music
The Legends of Rugby,2025-07-25,12:00,Grand Hyatt Melbourne,"123 Collins St, Melbourne VIC 3000, Australia",https://premier.ticketek.com.au/shows/show.aspx?sh=LEGRUGBY25,-37.8152075,144.9698275,
DOPE LEMON,2025-07-25,12:00,Forum Melbourne,"150 Flinders St, Melbourne VIC 3000, Australia",https://premier.ticketek.com.au/shows/show.aspx?sh=DOPELEM25,-37.8166268,144.9695761,
The Annual Castan Centre for Human Rights Law Conference,2025-07-25,08:30,"Conversation Quarter and Theatrette,  Conference Centre, Entry 3, State Library Victoria","179 La Trobe Street Melbourne, VIC 3000",https://www.eventbrite.com.au/e/the-annual-castan-centre-for-human-rights-law-conference-tickets-1320621657929?aff=ebdssbdestsearch,-37.809415,144.9652062,Talks/Workshops
Cheers to That: A Night of Books and Beers,2025-07-26,00:00,The Wheeler Centre,"176 Little Lonsdale St, Melbourne VIC 3000, Australia",https://www.facebook.com/events/852468243757378/,-37.8101765,144.9652219,Social/Dating
One Direction 15 Year Anniversary Party - Melbourne,2025-07-26,20:00,Max Watts,"125 Swanston St, Melbourne VIC 3000, Australia",https://www.facebook.com/events/540276355827503/,-37.8147557,144.9659879,Music
Christmas in July,2025-07-26,00:00,Taxi Kitchen,"Taxi Kitchen, Transport Hotel, Level 1 Federation Square, Melbourne VIC 3000, Australia",https://www.facebook.com/events/1707621383461365/,-37.81820779,144.9683928,Social/Dating
Christmas in July at Stamford Plaza Melbourne,2025-07-26,00:00,Stamford Plaza Melbourne,"111 Little Collins St, Melbourne VIC 3000, Australia",https://www.facebook.com/events/2099832587161298/,-37.81359225,144.9700614178762,Social/Dating
"Snuggle Party Brunswick: connect, consent & cuddle",2025-07-26,18:00,Studio Take Care,"1 Pitt Street Brunswick, VIC 3056",https://www.eventbrite.com.au/e/snuggle-party-brunswick-connect-consent-cuddle-tickets-1142083635899?aff=ebdssbdestsearch,-37.7711984,144.9711714,Social/Dating
SOS!!!									The Australian ABBA Tribute Show.,2025-07-26,20:00,Moonee Ponds Bowling Club,"776 Mount Alexander Road Moonee Ponds, VIC 3039",https://www.eventbrite.com.au/e/sos-the-australian-abba-tribute-show-tickets-1316987287429?aff=ebdssbdestsearch,-37.7622056,144.922656,Unknown
Japanese Tea 101,2025-07-26,11:00,Mystik River,"3 Southgate Avenue Southbank, VIC 3006",https://www.eventbrite.com.au/e/japanese-tea-101-tickets-1261816369729?aff=ebdssbdestsearch,-37.820556,144.965833,Talks/Workshops
SUNDAYLICIOUS RnB |  SATURDAY  NIGHT | JULY 26 | 8pm - 3am | LGBTQIA+ event,2025-07-26,20:00,La Di Da,"577 Little Bourke Street Melbourne, VIC 3000",https://www.eventbrite.com.au/e/sundaylicious-rnb-saturday-night-july-26-8pm-3am-lgbtqia-event-tickets-1333355765989?aff=ebdssbdestsearch,-37.8154693,144.9556119,Music
Peruvian Independence Day  @ Plough Hotel Footscray,2025-07-26,18:00,333 Barkly St,"333 Barkly Street Footscray, VIC 3011",https://www.eventbrite.com.au/e/peruvian-independence-day-plough-hotel-footscray-tickets-1329371880079?aff=ebdssbdestsearch,-37.7991718,144.8928504,Music
Manchester Unity Building Tour,2025-07-27,10:00,Manchester Unity Building,"Ground Floor 220 Collins Street Melbourne, VIC 3000",https://www.eventbrite.com.au/e/manchester-unity-building-tour-tickets-1298784893579?aff=ebdssbdestsearch,-37.8182902,144.9566734,Talks/Workshops
MAINSTREAM Conference July 2025,2025-07-27,18:00,CENTREPIECE at Melbourne Park,"Olympic Boulevard Melbourne, VIC 3000",https://www.eventbrite.com.au/e/mainstream-conference-july-2025-tickets-1115065122799?aff=ebdssbdestsearch,-37.8231282,144.9764579,Business/Networking
"Meet Dr Sandra Cabot MD, One Day Only Health Seminar Melbourne, 27 July 25",2025-07-27,09:30,Malvern Town Hall,"1251 High Street Malvern, VIC 3144",https://www.eventbrite.com.au/e/meet-dr-sandra-cabot-md-one-day-only-health-seminar-melbourne-27-july-25-tickets-1307490000789?aff=ebdssbdestsearch,-37.8562757,145.0297103,Talks/Workshops
"Salesforce Administrator Training Melbourne, VIC In-Person Class",2025-07-28,19:00,"Levels 31 & 50/120 Collins St, Melbourne, VIC, 3000, Australia","Levels 31 & 50/120 Collins St Melbourne, VIC 3000",https://www.eventbrite.com/e/salesforce-administrator-training-melbourne-vic-in-person-class-tickets-1339142052929?aff=ebdssbdestsearch,-37.8144291,144.9696066,Talks/Workshops
PODD Speech Generating Device Workshop,2025-07-28,19:30,Cerebral Palsy Education Centre,"Beacon Street Glen Waverley, VIC 3150",https://www.eventbrite.com.au/e/podd-speech-generating-device-workshop-tickets-1320660343639?aff=ebdssbdestsearch,-37.8856164,145.1635261,Talks/Workshops
Certificate II in Security Operations (CPP20218) - Tullamarine,2025-07-28,08:30,Tullamarine,"TBC Tullamarine, VIC 3043",https://www.eventbrite.com.au/e/certificate-ii-in-security-operations-cpp20218-tullamarine-tickets-1301617596269?aff=ebdssbdestsearch,-37.7044206,144.8786231,Talks/Workshops
"PURE - Balayage Mastery Workshop - Melbourne, VIC",2025-07-28,10:00,Aé&M Salon,"21-27 Brunswick Road Shop 4 Brunswick East, VIC 3057",https://www.eventbrite.com.au/e/pure-balayage-mastery-workshop-melbourne-vic-tickets-1254020321539?aff=ebdssbdestsearch,-37.7787636,144.9766404,Talks/Workshops
Employment Law & Workplace Relations Masterclass Melbourne,2025-07-29,09:00,CBD Melbourne,"1/440 Collins St Melbourne, VIC 3000",https://www.eventbrite.com/e/employment-law-workplace-relations-masterclass-melbourne-tickets-1235353277909?aff=ebdssbdestsearch,-37.8170853,144.9598938,Talks/Workshops
AI and Automation In Business​,2025-07-29,09:00,Melbourne Marriott Hotel Docklands,"15 Waterfront Way Docklands, VIC 3008",https://www.eventbrite.com.au/e/ai-and-automation-in-business-tickets-1323201544439?aff=ebdssbdestsearch,-37.8136886,144.939224,Business/Networking
THE ULTIMATE EVENT ON BUILDING SOCIAL PLATFORMS AND SOCIAL CONNECTION,2025-07-29,06:30,Roxy's Functions & Events,"2 Alfred Place South Melbourne, VIC 3205",https://www.eventbrite.com/e/the-ultimate-event-on-building-social-platforms-and-social-connection-tickets-1278969244439?aff=ebdssbdestsearch,-37.8313626,144.9592064,Business/Networking
DevSecOps Focal Point Forum 2025 | 29 - 30 July 2025 | Melbourne Australia,2025-07-29,09:00,Melbourne Marriott Hotel Docklands,"15 Waterfront Way Docklands, VIC 3008",https://www.eventbrite.com.au/e/devsecops-focal-point-forum-2025-29-30-july-2025-melbourne-australia-tickets-1143819507939?aff=ebdssbdestsearch,-37.8136886,144.939224,Business/Networking
Authentic Assessment in the Early Childhood Years,2025-07-29,09:00,Melbourne,"City Melbourne, VIC 3000",https://www.eventbrite.sg/e/authentic-assessment-in-the-early-childhood-years-tickets-1351463416459?aff=ebdssbdestsearch,-37.8152065,144.963937,Talks/Workshops
The Startup Network Presents: Pitch Night!,2025-07-29,18:00,The Commons Gipps St,"38 Gipps St Collingwood, VIC 3066",https://www.eventbrite.com.au/e/the-startup-network-presents-pitch-night-tickets-1089406116019?aff=ebdssbdestsearch,-37.8041282,144.9882914,Business/Networking
"YTM Progressive Dinner 2025 Insight : Why I started... and why I stopped""",2025-07-29,17:30,The Deck Brighton,"212 Bay Street Brighton, VIC 3186",https://www.eventbrite.com.au/e/ytm-progressive-dinner-2025-insight-why-i-started-and-why-i-stopped-tickets-1280075282629?aff=ebdssbdestsearch,-37.9052818,144.999296,Business/Networking
Ms Julie Gabler: Trapped,2025-07-30,19:30,TW Explosives Factory,"67 Inkerman Street St Kilda, VIC 3182",https://www.eventbrite.com.au/e/ms-julie-gabler-trapped-tickets-1110990906709?aff=ebdssbdestsearch,-37.8646651,144.9842743,Theatre
Motov8ing Boys -  MELBOURNE,2025-07-30,19:00,Deakin University,"LT1A, Building I Burwood, VIC 3125",https://www.eventbrite.com.au/e/motov8ing-boys-melbourne-tickets-1334861991149?aff=ebdssbdestsearch,-37.8494981,145.1090089,Talks/Workshops
Contract Law Fundamentals for Non-Lawyers Masterclass Melbourne,2025-07-30,09:00,CBD Melbourne,"1/440 Collins St Melbourne, VIC 3000",https://www.eventbrite.com/e/contract-law-fundamentals-for-non-lawyers-masterclass-melbourne-tickets-1247634110209?aff=ebdssbdestsearch,-37.8170853,144.9598938,Talks/Workshops
FYI 20% tix sold!! X 'At Home With You' 40th Anniversary FRI 1st AUG @ Shotkicker w/ VELVET PARADE,2025-08-01,20:00,Shotkickers,"744 High St, Thornbury VIC 3071, Australia",https://www.facebook.com/events/671294125814401/,-37.75592655,145.0013923,Music
Plaited Leather Dog Lead Class with Aram Omara,2025-08-01,09:00,Leffler Leather,"171 Kensington Road West Melbourne, VIC 3003",https://www.eventbrite.com.au/e/plaited-leather-dog-lead-class-with-aram-omara-tickets-1119487440069?aff=ebdssbdestsearch,-37.8002118,144.9177331,Talks/Workshops
Report Writing (Melbourne),2025-08-01,09:00,123 Queen St,"123 Queen Street Melbourne, VIC 3000",https://www.eventbrite.com/e/report-writing-melbourne-tickets-750609532317?aff=ebdssbdestsearch,-37.8157528,144.9607103,Talks/Workshops
Baggy Trousers + Loonee Tunes - 'The Sounds of Madness and The Specials' at Australia's Home of Ska ,2025-08-02,19:30,THE CURTIN (John Curtin hotel),"29 Lygon St, Carlton VIC 3053, Australia",https://www.facebook.com/events/1206622287791807/,-37.8061581,144.9657057,Music
Starman The David Bowie Tribute Show at Oakleigh Music Hall,2025-08-02,20:00,Oakleigh Carnegie RSL,"95/97 Drummond St, Oakleigh VIC 3166, Australia",https://www.facebook.com/events/1823070371832721/,-37.8968576,145.08963741959553,Music
Silverstein | Melbourne,2025-08-02,19:00,Northcote Theatre,"216 High St, Northcote VIC 3070, Australia",https://www.facebook.com/events/671149682047847/,-37.7737068,144.9982706,Music
STARS,2025-08-03,14:00,Way Out West Roots Music Club,"4 Market St, Newport VIC 3015, Australia",https://www.facebook.com/events/1088684486636124/,-37.8439028,144.8823845,Music
Developing High Performing Teams Workshop (Melbourne),2025-08-05,09:00,Karstens Melbourne,"123 Queen St, Melbourne VIC 3000, Australia 123 Queen Street Melbourne, VIC 3000",https://www.eventbrite.com.au/e/developing-high-performing-teams-workshop-melbourne-tickets-1116129656849?aff=ebdssbdestsearch,-37.815914,144.9608628,Talks/Workshops
Sondheim Unbound ,2025-08-08,17:30,Paris Cat Jazz Club,"6 Goldie Pl, Melbourne VIC 3000, Australia",https://www.facebook.com/events/673835475281765/,-37.8133262,144.96060714767358,Music
Sons Of The East | Melbourne,2025-08-08,19:00,Northcote Theatre,"216 High St, Northcote VIC 3070, Australia",https://www.facebook.com/events/952696133514412/,-37.7737068,144.9982706,Music
Benchmark Wines of Australia Long Lunch at Smith St Bistrot | Melbourne,2025-08-09,12:30,Smith St Bistrot,"300 Smith Street Collingwood, VIC 3066",https://www.eventbrite.com.au/e/benchmark-wines-of-australia-long-lunch-at-smith-st-bistrot-melbourne-tickets-1292176327179?aff=ebdssbdestsearch,-37.8002354,144.9842903,Social/Dating
Denim & Lace 50th Anniversary Celebration featuring The CLIFF & OLIVIA Show,2025-08-09,19:30,Palladium at Crown,"Level 1 Crown Towers, Crown Melbourne, 8 Whiteman St, Southbank VIC 3006, Australia",https://www.facebook.com/events/598792006459366/,-37.822181,144.959875,Music
[SOLD OUT] The Preatures - 'Blue Planet Eyes' 10th Anniversary Australian Tour - Northcote Theatre,2025-08-09,19:00,Northcote Theatre,"216 High St, Northcote VIC 3070, Australia",https://www.facebook.com/events/445486871960198/,-37.7737068,144.9982706,Music
FELONY. – ‘MIDNIGHT MONEY’ TOUR | MELBOURNE,2025-08-09,19:30,280 Sydney Rd,"280 Sydney Road Brunswick, VIC 3056",https://www.eventbrite.com.au/e/felony-midnight-money-tour-melbourne-tickets-1096924523779?aff=ebdssbdestsearch,-37.7711488,144.9616353,Music
Mark Knight (UK) | Winter Series pres by. Thick as Thieves,2025-08-10,00:00,Revolver Upstairs,"Level 2/229 Chapel St, Prahran VIC 3181, Australia",https://www.facebook.com/events/959576479687718/,-37.8505902,144.9933469,Music
PUP // Melbourne // Do It Australian Tour 2025 // Northcote Theatre | 18+,2025-08-10,19:30,Northcote Theatre,"216 High St, Northcote VIC 3070, Australia",https://www.facebook.com/events/1395843268251417/,-37.7737068,144.9982706,Music
PEPPERCREEK REVIVAL,2025-08-10,14:00,Way Out West Roots Music Club,"4 Market St, Newport VIC 3015, Australia",https://www.facebook.com/events/551560891296898/,-37.8439028,144.8823845,Music
LinkedIn+: LinkedIn and personal branding workshop,2025-08-12,09:30,T.O.M.S Place - Brunswick,"1 Tripovich Street Brunswick, VIC 3056",https://www.eventbrite.com.au/e/linkedin-linkedin-and-personal-branding-workshop-tickets-924964181767?aff=ebdssbdestsearch,-37.7661862,144.9612696,Business/Networking
Creating Successful Futures - The Alliance for Better Childcare Development,2025-08-13,09:00,700 Bourke St,"700 Bourke Street Docklands, VIC 3008",https://www.eventbrite.com.au/e/creating-successful-futures-the-alliance-for-better-childcare-development-tickets-1108884877519?aff=ebdssbdestsearch,-37.8174668,144.9493184,Talks/Workshops
"One Night of Adele - Live at The Palms at Crown, Melbourne, VIC",2025-08-13,00:00,Palladium at Crown,"Level 1 Crown Towers, Crown Melbourne, 8 Whiteman St, Southbank VIC 3006, Australia",https://www.facebook.com/events/1336156307673185/,-37.822181,144.959875,Music
Hypnotist Comedy Show with Gerard V | Stamford Plaza Melbourne,2025-08-15,00:00,Stamford Plaza Melbourne,"111 Little Collins St, Melbourne VIC 3000, Australia",https://www.facebook.com/events/1890806535010513/,-37.81359225,144.9700614178762,Comedy
Developing Executive Presence and Maximising Your Impact (Melbourne),2025-08-15,09:00,Karstens Melbourne,"123 Queen St, Melbourne VIC 3000, Australia 123 Queen Street Melbourne, VIC 3000",https://www.eventbrite.com.au/e/developing-executive-presence-and-maximising-your-impact-melbourne-tickets-1116140248529?aff=ebdssbdestsearch,-37.8157528,144.9607103,Business/Networking
Toni Childs - A Retrospective - The Palms At Crown,2025-08-15,19:30,Palladium at Crown,"Level 1 Crown Towers, Crown Melbourne, 8 Whiteman St, Southbank VIC 3006, Australia",https://www.facebook.com/events/1404417827535166/,-37.822181,144.959875,Music
Portal + Bølzer | Melbourne | Max Watts,2025-08-16,00:00,Max Watts,"125 Swanston St, Melbourne VIC 3000, Australia",https://www.facebook.com/events/1301143130973380/,-37.8147557,144.9659879,Music
Nastia (UA) | Winter Series pres by. Thick as Thieves,2025-08-17,00:00,Revolver Upstairs,"Level 2/229 Chapel St, Prahran VIC 3181, Australia",https://www.facebook.com/events/1296236871473442/,-37.8505902,144.9933469,Music
"Tyler, The Creator",2025-08-20,19:30,Rod Laver Arena,"200 Batman Ave, Melbourne VIC 3000, Australia",https://premier.ticketek.com.au/shows/show.aspx?sh=TYLERTHE25,-37.8216161,144.9785584,
"Conflict Management Tactics  - 1 Day Workshop, Melbourne",2025-08-20,09:00,Karstens Melbourne,"123 Queen Street Melbourne, VIC 3000",https://www.eventbrite.com.au/e/conflict-management-tactics-1-day-workshop-melbourne-tickets-133044274005?aff=ebdssbdestsearch,-37.8157528,144.9607103,Talks/Workshops
BNI Platinum One - Networking at MCG,2025-08-21,06:45,Melbourne Cricket Ground,"Brunton Avenue Richmond, VIC 3002",https://www.eventbrite.com.au/e/bni-platinum-one-networking-at-mcg-tickets-1117096699299?aff=ebdssbdestsearch,-37.8214457,144.9834593,Business/Networking
The Machine Stops,2025-08-22,19:30,Theatre Works,"Saint Leonards Avenue St Kilda, VIC 3182",https://www.eventbrite.com.au/e/the-machine-stops-tickets-1110782302769?aff=ebdssbdestsearch,-37.8638328,144.9768976,Theatre
Akmal - LIVE - Thornbury,2025-08-22,19:30,The Thornbury Theatre,"859 High St, Thornbury VIC 3071, Australia",https://www.facebook.com/events/594485380317679/,-37.754662,145.0011167,Comedy
Altona Beach Film Festival | 2025 Film Premiere & Award Presentation,2025-08-23,00:00,Altona Sports Club,"11 Altona Rd, Altona VIC 3018, Australia",https://www.facebook.com/events/1428262988554725/,-37.85754867,144.85121805353086,Cinema
"Duncan Trussell: Thornbury Theatre, Melbourne",2025-08-23,18:00,The Thornbury Theatre,"859 High St, Thornbury VIC 3071, Australia",https://www.facebook.com/events/1886191708876144/,-37.754662,145.0011167,Comedy
Dr Joe Dispenza CHANGE YOUR MIND…CREATE NEW RESULTS with Angelina Morley,2025-08-24,08:30,Melbourne CERES in the Van Raay Room,"Cnr Stewart Street Roberts Street Brunswick East, VIC 3057",https://www.eventbrite.com/e/dr-joe-dispenza-change-your-mindcreate-new-results-with-angelina-morley-tickets-1055671936179?aff=ebdssbdestsearch,-37.7656615,144.9824113,Talks/Workshops
The Simon & Garfunkel Story,2025-08-24,12:00,Hamer Hall,"32 Southgate Ave, Southbank VIC 3006, Australia",https://premier.ticketek.com.au/shows/show.aspx?sh=SIMONGAR25,-37.8201455,144.9679946,
Keith Urban,2025-08-25,12:00,Rod Laver Arena,"200 Batman Ave, Melbourne VIC 3000, Australia",https://premier.ticketek.com.au/shows/show.aspx?sh=KEITHURB25,-37.8216161,144.9785584,
Alex Warren,2025-08-25,12:00,Forum Melbourne,"150 Flinders St, Melbourne VIC 3000, Australia",https://premier.ticketek.com.au/shows/show.aspx?sh=WARREN25,-37.8166268,144.9695761,
Time Management Training Course (Melbourne),2025-08-27,09:00,Karstens Melbourne,"123 Queen St, Melbourne VIC 3000, Australia 123 Queen Street Melbourne, VIC 3000",https://www.eventbrite.com.au/e/time-management-training-course-melbourne-tickets-1112144587399?aff=ebdssbdestsearch,-37.815914,144.9608628,Talks/Workshops
Russell Morris,2025-08-27,12:00,Hamer Hall,"32 Southgate Ave, Southbank VIC 3006, Australia",https://premier.ticketek.com.au/shows/show.aspx?sh=RUSSELLM25,-37.8201455,144.9679946,
Implementing SSP in Primary Schools Using PLD,2025-08-29,09:00,United Co.,"425 Smith Street Fitzroy, VIC 3065",https://www.eventbrite.com.au/e/implementing-ssp-in-primary-schools-using-pld-tickets-1231756760629?aff=ebdssbdestsearch,-37.7956368,144.9844614,Talks/Workshops
Saving Grace - Jungle Fever Tour,2025-08-31,05:00,Saving Grace,"32 Church Ln, Melbourne VIC 3000, Australia",https://www.facebook.com/events/1363156408070206/,-37.8177293,144.9577832,Music
Prioritising & Planning Workshop (Brisbane),2025-09-02,09:00,123 Queen St,"123 Queen Street Melbourne, VIC 3000",https://www.eventbrite.com/e/prioritising-planning-workshop-brisbane-tickets-732667637627?aff=ebdssbdestsearch,-37.8157528,144.9607103,Talks/Workshops
Paul Kelly,2025-09-02,12:00,MyState Bank Arena,"601 Brooker Hwy, Glenorchy TAS 7010, Australia",https://premier.ticketek.com.au/shows/show.aspx?sh=PAULKELL25&v=MYB,-42.82416569999999,147.2827222,
"Effective Communication Skills  with DISC - 1 Day Workshop, Melbourne",2025-09-02,09:00,Karstens Melbourne,"123 Queen Street Melbourne, VIC 3000",https://www.eventbrite.com.au/e/effective-communication-skills-with-disc-1-day-workshop-melbourne-tickets-133031925069?aff=ebdssbdestsearch,-37.8157528,144.9607103,Talks/Workshops
Minute Taking Skills Workshop (Melbourne),2025-09-03,09:00,123 Queen St,"123 Queen Street Melbourne, VIC 3000",https://www.eventbrite.com/e/minute-taking-skills-workshop-melbourne-tickets-744796776207?aff=ebdssbdestsearch,-37.8157528,144.9607103,Talks/Workshops
Sabaton,2025-09-05,12:00,Margaret Court Arena,"5XHH+G3 Melbourne VIC, Australia",https://premier.ticketek.com.au/shows/show.aspx?sh=SABAT25,-37.8211276,144.9776364,
Evolution Events presents Evolve Boiler 360 Vol.2,2025-09-06,17:00,Festival Hall,"300 Dudley St, West Melbourne VIC 3003, Australia",https://www.facebook.com/events/1721845811756276/,-37.8098193,144.9508057,Other
Max Styler (US) | Winter Series pres by. Thick as Thieves,2025-09-07,00:00,Revolver Upstairs,"Level 2/229 Chapel St, Prahran VIC 3181, Australia",https://www.facebook.com/events/2138787836578501/,-37.8505902,144.9933469,Music
Ray Chen in Recital,2025-09-08,12:00,Hamer Hall,"100 St Kilda Rd, Southbank VIC 3004, Australia",https://premier.ticketek.com.au/shows/show.aspx?sh=RAYCHEN25,-37.8201455,144.9679946,
Critical Thinking Training,2025-09-09,07:30,Melbourne,"Melbourne Melbourne, VIC",https://www.eventbrite.com.au/e/critical-thinking-training-tickets-886595008537?aff=ebdssbdestsearch,-37.8136276,144.9630576,Talks/Workshops
Mayday Parade // Melbourne // MCA // with Jack's Mannequin & The Home Team ,2025-09-12,18:00,Margaret Court Arena,"Olympic Blvd, Melbourne VIC 3001, Australia",https://www.facebook.com/events/3838058729838509/,-37.82305598,144.97619022672723,Music
LeAnn Rimes,2025-09-16,12:00,John Cain Arena,"35 Olympic Blvd, Melbourne VIC 3000, Australia",https://premier.ticketek.com.au/shows/show.aspx?sh=LEANN25,-37.8227725,144.9819687,
Animals As Leaders,2025-09-18,12:00,Forum Melbourne,"150 Flinders St, Melbourne VIC 3000, Australia",https://premier.ticketek.com.au/shows/show.aspx?sh=ALEADERS25,-37.8166268,144.9695761,
Kate Ceberano,2025-09-19,12:00,Hamer Hall,"32 Southgate Ave, Southbank VIC 3006, Australia",https://premier.ticketek.com.au/shows/show.aspx?sh=KATECMEL25,-37.8201455,144.9679946,
Giving Employee Feedback With Precision (Melbourne),2025-09-19,09:00,Karstens Melbourne,"123 Queen St, Melbourne VIC 3000, Australia 123 Queen Street Melbourne, VIC 3000",https://www.eventbrite.com.au/e/giving-employee-feedback-with-precision-melbourne-tickets-1116112776359?aff=ebdssbdestsearch,-37.8157528,144.9607103,Talks/Workshops
The Mary Wallopers,2025-09-19,12:00,Forum Melbourne,"150 Flinders St, Melbourne VIC 3000, Australia",https://premier.ticketek.com.au/shows/show.aspx?sh=MARYWALL25,-37.8166268,144.9695761,
Shamrock Tenors,2025-09-21,12:00,Hamer Hall,"32 Southgate Ave, Southbank VIC 3006, Australia",https://premier.ticketek.com.au/shows/show.aspx?sh=SHAMROCK25,-37.8201455,144.9679946,
Wunderhorse,2025-09-23,12:00,Forum Melbourne,"150 Flinders St, Melbourne VIC 3000, Australia",https://premier.ticketek.com.au/shows/show.aspx?sh=WHORSE25,-37.8166268,144.9695761,
Anastacia,2025-09-24,12:00,Forum Melbourne,"150 Flinders St, Melbourne VIC 3000, Australia",https://premier.ticketek.com.au/shows/show.aspx?sh=ANASNTK25,-37.8166268,144.9695761,
SWIM (live),2025-09-25,12:00,Forum Melbourne,"150 Flinders St, Melbourne VIC 3000, Australia",https://premier.ticketek.com.au/shows/show.aspx?sh=SWIM25,-37.8166268,144.9695761,
DIVORCED DAD (AND MUM) ROCK NIGHT #3,2025-09-26,22:00,EMO NEVER SLEEPS,"629 Bourke St, Melbourne VIC 3004, Australia",https://www.facebook.com/events/1045574704114791/,-37.8167994,144.9552063,Music
Township Rebellion | Winter Series pres by. Thick as Thieves,2025-09-28,00:00,Revolver Upstairs,"Level 2/229 Chapel St, Prahran VIC 3181, Australia",https://www.facebook.com/events/943475734297809/,-37.8505902,144.9933469,Music
Melbourne Ska Orchestra: The Ballad of Monte Loco Tour // MELBOURNE,2025-10-03,20:00,170 Russell,"170 Russell St, Melbourne VIC 3000, Australia",https://www.facebook.com/events/1750183082227543/,-37.8120109,144.9679369,Music
Email Etiquette and Response Writing Training,2025-10-03,13:00,Melbourne,"Melbourne Melbourne, VIC",https://www.eventbrite.com.au/e/email-etiquette-and-response-writing-training-tickets-886602230137?aff=ebdssbdestsearch,-37.8136276,144.9630576,Talks/Workshops
Marcia Sings Summer,2025-10-05,12:00,Hamer Hall,"32 Southgate Ave, Southbank VIC 3006, Australia",https://premier.ticketek.com.au/shows/show.aspx?sh=MARCIASI25,-37.8201455,144.9679946,
Jackson Dean,2025-10-05,12:00,Forum Melbourne,"150 Flinders St, Melbourne VIC 3000, Australia",https://premier.ticketek.com.au/shows/show.aspx?sh=JACKSOND25,-37.8166268,144.9695761,
